title,link,description
Google,https://www.google.ch/?hl=de,social security transparency initiatives · social security benefits · 23andme genetic data · pokémon tcg destined rivals pre order · final jeopardy march 24.
Google,https://de.wikipedia.org/wiki/Google,Google ist eine Internet-Suchmaschine des US-amerikanischen Unternehmens Google LLC. Google steht in direkter Konkurrenz zu anderen Suchmaschinen wie zum ...
Google - Info,https://about.google/intl/de_ch/,"Das Ziel von Google ist es, die Informationen der Welt zu organisieren und für alle zu jeder Zeit zugänglich und nutzbar zu machen. Erfahren Sie mehr über ..."
Google,https://www.google.com/,"Search the world's information, including webpages, images, videos and more. Google has many special features to help you find exactly what you're looking ..."
Google Ads ‒ Mit Onlinewerbung Kund*innen gewinnen ...,https://ads.google.com/intl/de_ch/home/,Mit Google Ads können Sie in verschiedenen Kanälen präsent sein · Mit Suchanzeigen loslegen · Aufmerksamkeit gewinnen · Inventar präsentieren · Mit Videos Ihrer ...
Über Google in der Schweiz,https://about.google/intl/de_ch/google-in-switzerland/,"In Zürich arbeiten über 5'000 Googler*innen aus 85 Nationen an Diensten wie Google Maps, Search und YouTube und entwickeln Anwendungen zu künstlicher ..."
Google Docs: Online Document & PDF Editor,https://workspace.google.com/products/docs/,"Create online documents and edit PDFs with Google Docs. Collaborate in real-time from any device and use AI to generate drafts, templates, and more."
Google Drive: Sign-in,https://sites.google.com/,Access Google Drive with a Google account (for personal use) or Google Workspace account (for business use).
